{
  "complete": true,
  "has_violations": false,
  "operation": {
    "method": "GET",
    "operation_id": "getList",
    "path": "/list/{ids}"
  },
  "request": {
    "complete": true,
    "diagnostics": [],
    "has_violations": false,
    "status": "valid",
    "valid": true
  },
  "response": {
    "complete": true,
    "diagnostics": [],
    "has_violations": false,
    "status": "skipped",
    "valid": false
  },
  "valid": true
}
