{
  "complete": true,
  "has_violations": true,
  "operation": {
    "method": "POST",
    "operation_id": "createUser",
    "path": "/users"
  },
  "request": {
    "complete": true,
    "diagnostics": [
      {
        "code": "body.decode",
        "detail": {
          "parser": "expected object key string"
        },
        "id": "d1",
        "instance": {
          "location": "body",
          "span": {
            "column": 12,
            "end": 30,
            "end_column": 12,
            "end_line": 3,
            "line": 3,
            "part": "position",
            "start": 30
          }
        },
        "message": "body is not well-formed JSON",
        "severity": "error",
        "side": "request",
        "suppressed_by": null
      }
    ],
    "has_violations": true,
    "status": "invalid",
    "valid": false
  },
  "response": {
    "complete": true,
    "diagnostics": [],
    "has_violations": false,
    "status": "skipped",
    "valid": false
  },
  "valid": false
}
