{
  "complete": true,
  "has_violations": true,
  "operation": {
    "method": "GET",
    "operation_id": "listItems",
    "path": "/items"
  },
  "request": {
    "complete": true,
    "diagnostics": [],
    "has_violations": false,
    "status": "valid",
    "valid": true
  },
  "response": {
    "complete": true,
    "diagnostics": [
      {
        "code": "response.header.invalid",
        "id": "d1",
        "instance": {
          "location": "header",
          "name": "Set-Cookie"
        },
        "message": "response header \"Set-Cookie\" is invalid",
        "severity": "error",
        "side": "response",
        "suppressed_by": null
      }
    ],
    "has_violations": true,
    "status": "invalid",
    "valid": false
  },
  "valid": false
}
