{
  "complete": false,
  "has_violations": true,
  "request": {
    "complete": false,
    "diagnostics": [
      {
        "code": "operation.not_found",
        "id": "d1",
        "instance": {
          "location": "operation"
        },
        "message": "no operation matches the request path",
        "severity": "error",
        "side": "request",
        "suppressed_by": null
      }
    ],
    "has_violations": true,
    "status": "invalid",
    "valid": false
  },
  "response": {
    "complete": true,
    "diagnostics": [],
    "has_violations": false,
    "status": "skipped",
    "valid": false
  },
  "valid": false
}
