{
  "complete": true,
  "has_violations": false,
  "operation": {
    "method": "GET",
    "operation_id": "getUser",
    "path": "/users/{id}"
  },
  "request": {
    "complete": true,
    "diagnostics": [
      {
        "code": "body.undeclared",
        "detail": {
          "media_type": "application/json"
        },
        "id": "d1",
        "instance": {
          "location": "body"
        },
        "message": "a body was sent but the operation declares no content for it",
        "severity": "warning",
        "side": "request",
        "suppressed_by": null
      }
    ],
    "has_violations": false,
    "status": "valid",
    "valid": true
  },
  "response": {
    "complete": true,
    "diagnostics": [],
    "has_violations": false,
    "status": "skipped",
    "valid": false
  },
  "valid": true
}
