{
  "complete": true,
  "has_violations": true,
  "operation": {
    "method": "GET",
    "operation_id": "listItems",
    "path": "/items"
  },
  "request": {
    "complete": true,
    "diagnostics": [
      {
        "code": "parameter.required",
        "id": "d1",
        "instance": {
          "location": "cookie",
          "name": "session"
        },
        "message": "cookie parameter \"session\" is required but missing",
        "severity": "error",
        "side": "request",
        "suppressed_by": null
      }
    ],
    "has_violations": true,
    "status": "invalid",
    "valid": false
  },
  "response": {
    "complete": true,
    "diagnostics": [],
    "has_violations": false,
    "status": "skipped",
    "valid": false
  },
  "valid": false
}
