{
  "complete": true,
  "has_violations": true,
  "operation": {
    "method": "POST",
    "operation_id": "createOrder",
    "path": "/orders"
  },
  "request": {
    "complete": true,
    "diagnostics": [
      {
        "code": "schema.additional_properties",
        "id": "d1",
        "instance": {
          "location": "body",
          "pointer": "/qty",
          "span": {
            "column": 16,
            "end": 20,
            "end_column": 21,
            "end_line": 1,
            "line": 1,
            "part": "key",
            "start": 15
          }
        },
        "message": "body at /qty is not allowed by the schema",
        "schema": {
          "pointer": "/allOf/0/$ref/additionalProperties",
          "relative": true
        },
        "severity": "error",
        "side": "request",
        "suppressed_by": null
      },
      {
        "actual": "string",
        "code": "schema.type",
        "expected": [
          "integer"
        ],
        "id": "d2",
        "instance": {
          "location": "body",
          "pointer": "/qty",
          "span": {
            "column": 16,
            "end": 20,
            "end_column": 21,
            "end_line": 1,
            "line": 1,
            "part": "key",
            "start": 15
          }
        },
        "message": "body at /qty violates schema keyword \"type\"",
        "schema": {
          "pointer": "/allOf/1/properties/qty/type",
          "relative": true
        },
        "severity": "error",
        "side": "request",
        "suppressed_by": null
      }
    ],
    "has_violations": true,
    "status": "invalid",
    "valid": false
  },
  "response": {
    "complete": true,
    "diagnostics": [],
    "has_violations": false,
    "status": "skipped",
    "valid": false
  },
  "valid": false
}
