{
  "complete": true,
  "has_violations": true,
  "operation": {
    "method": "POST",
    "operation_id": "createUser",
    "path": "/users"
  },
  "request": {
    "complete": true,
    "diagnostics": [
      {
        "code": "parameter.invalid",
        "id": "d1",
        "instance": {
          "location": "header",
          "name": "X-Request-Id"
        },
        "message": "header parameter \"X-Request-Id\" is invalid",
        "severity": "error",
        "side": "request",
        "suppressed_by": null
      }
    ],
    "has_violations": true,
    "status": "invalid",
    "valid": false
  },
  "response": {
    "complete": true,
    "diagnostics": [],
    "has_violations": false,
    "status": "skipped",
    "valid": false
  },
  "valid": false
}
