{
  "complete": true,
  "has_violations": true,
  "operation": {
    "method": "POST",
    "operation_id": "createUser",
    "path": "/users"
  },
  "request": {
    "complete": true,
    "diagnostics": [
      {
        "code": "schema.type",
        "id": "d1",
        "instance": {
          "location": "body",
          "pointer": "/profile",
          "span": {
            "column": 33,
            "end": 38,
            "end_column": 39,
            "end_line": 1,
            "line": 1,
            "start": 32
          }
        },
        "message": "body at /profile violates schema keyword \"type\"",
        "schema": {
          "column": 7,
          "line": 81,
          "pointer": "/properties/profile/type",
          "relative": true
        },
        "severity": "error",
        "side": "request",
        "suppressed_by": null
      }
    ],
    "has_violations": true,
    "status": "invalid",
    "valid": false
  },
  "response": {
    "complete": true,
    "diagnostics": [],
    "has_violations": false,
    "status": "skipped",
    "valid": false
  },
  "valid": false
}
