{
  "complete": true,
  "has_violations": true,
  "operation": {
    "method": "PUT",
    "operation_id": "putVcl",
    "path": "/vcl"
  },
  "request": {
    "complete": true,
    "diagnostics": [],
    "has_violations": false,
    "status": "valid",
    "valid": true
  },
  "response": {
    "complete": true,
    "diagnostics": [
      {
        "code": "schema.minLength",
        "id": "d1",
        "instance": {
          "location": "body"
        },
        "message": "body violates schema keyword \"minLength\"",
        "schema": {
          "column": 24,
          "line": 181,
          "pointer": "/minLength",
          "relative": true
        },
        "severity": "error",
        "side": "response",
        "suppressed_by": null
      }
    ],
    "has_violations": true,
    "status": "invalid",
    "valid": false
  },
  "valid": false
}
