{
  "complete": true,
  "has_violations": true,
  "operation": {
    "method": "GET",
    "operation_id": "listItems",
    "path": "/items"
  },
  "request": {
    "complete": true,
    "diagnostics": [],
    "has_violations": false,
    "status": "valid",
    "valid": true
  },
  "response": {
    "complete": true,
    "diagnostics": [
      {
        "code": "response.header.required",
        "id": "d1",
        "instance": {
          "location": "header",
          "name": "X-Rate-Limit"
        },
        "message": "response header \"X-Rate-Limit\" is required but missing",
        "severity": "error",
        "side": "response",
        "suppressed_by": null
      },
      {
        "actual": "string",
        "code": "schema.type",
        "expected": [
          "integer"
        ],
        "id": "d2",
        "instance": {
          "location": "body",
          "pointer": "/1/id",
          "span": {
            "column": 28,
            "end": 30,
            "end_column": 31,
            "end_line": 1,
            "line": 1,
            "start": 27
          }
        },
        "message": "body at /1/id violates schema keyword \"type\"",
        "schema": {
          "column": 17,
          "line": 93,
          "pointer": "/items/$ref/properties/id/type",
          "relative": true
        },
        "severity": "error",
        "side": "response",
        "suppressed_by": null
      }
    ],
    "has_violations": true,
    "status": "invalid",
    "valid": false
  },
  "valid": false
}
