{
  "complete": true,
  "has_violations": true,
  "operation": {
    "method": "POST",
    "operation_id": "postFormTyped",
    "path": "/form-typed"
  },
  "request": {
    "complete": true,
    "diagnostics": [
      {
        "code": "body.decode",
        "detail": {
          "media_type": "application/x-www-form-urlencoded"
        },
        "id": "d1",
        "instance": {
          "location": "body"
        },
        "message": "body could not be decoded as application/x-www-form-urlencoded",
        "severity": "error",
        "side": "request",
        "suppressed_by": null
      }
    ],
    "has_violations": true,
    "status": "invalid",
    "valid": false
  },
  "response": {
    "complete": true,
    "diagnostics": [],
    "has_violations": false,
    "status": "skipped",
    "valid": false
  },
  "valid": false
}
